{
  "generatedNotice": "Generated from @knpkv/rly/component-manifest.ts. Do not edit.",
  "package": "@knpkv/rly",
  "schemaVersion": 1,
  "components": [
    {
      "accessibility": {
        "automatedChecks": true,
        "requirements": [
          "Provide a programmatic name for interactive or informative content",
          "Preserve keyboard access, focus visibility, and color-independent meaning"
        ],
        "standard": "WCAG 2.2 AA"
      },
      "capabilities": [
        "agent",
        "open"
      ],
      "category": "pattern",
      "compatibleTokens": [
        "color",
        "motion",
        "radius",
        "space",
        "type"
      ],
      "docs": {
        "autogenerated": true,
        "storyId": "patterns-agentcontextbutton--contexts",
        "storyPath": "?path=/story/patterns-agentcontextbutton--contexts"
      },
      "example": "import { AgentContextButton } from \"@knpkv/rly/patterns\"",
      "exports": [
        {
          "kind": "value",
          "name": "AgentContextButton"
        },
        {
          "kind": "type",
          "name": "AgentContextButtonProps"
        },
        {
          "kind": "type",
          "name": "RlyAgentJobSummary"
        }
      ],
      "files": {
        "source": "src/patterns/AgentContextButton.tsx",
        "story": "stories/patterns/AgentContextButton.stories.tsx",
        "styles": [
          "src/patterns/AgentContextButton.module.css"
        ],
        "tests": [
          "test/patterns/AgentContextButton.test.tsx"
        ]
      },
      "importPath": "@knpkv/rly/patterns",
      "name": "AgentContextButton",
      "props": {
        "defaults": {},
        "types": [
          "AgentContextButtonProps"
        ]
      },
      "purpose": "Open an agent in the exact current entity or release context",
      "slots": [],
      "states": [
        "complete",
        "default"
      ],
      "status": "stable",
      "variants": []
    },
    {
      "accessibility": {
        "automatedChecks": true,
        "requirements": [
          "Provide a programmatic name for interactive or informative content",
          "Preserve keyboard access, focus visibility, and color-independent meaning"
        ],
        "standard": "WCAG 2.2 AA"
      },
      "capabilities": [
        "agent",
        "overlay"
      ],
      "category": "pattern",
      "compatibleTokens": [
        "color",
        "motion",
        "radius",
        "space",
        "type"
      ],
      "docs": {
        "autogenerated": true,
        "storyId": "patterns-agentdrawer--interaction",
        "storyPath": "?path=/story/patterns-agentdrawer--interaction"
      },
      "example": "import { AgentDrawer } from \"@knpkv/rly/patterns\"",
      "exports": [
        {
          "kind": "value",
          "name": "AgentDrawer"
        },
        {
          "kind": "type",
          "name": "AgentDrawerProps"
        }
      ],
      "files": {
        "source": "src/patterns/AgentDrawer.tsx",
        "story": "stories/patterns/AgentDrawer.stories.tsx",
        "styles": [
          "src/patterns/AgentDrawer.module.css"
        ],
        "tests": [
          "test/patterns/AgentDrawer.test.tsx"
        ]
      },
      "importPath": "@knpkv/rly/patterns",
      "name": "AgentDrawer",
      "props": {
        "defaults": {},
        "types": [
          "AgentDrawerProps"
        ]
      },
      "purpose": "Host release-aware agent context, thread, jobs, and proposals",
      "slots": [],
      "states": [
        "default",
        "open"
      ],
      "status": "stable",
      "variants": []
    },
    {
      "accessibility": {
        "automatedChecks": true,
        "requirements": [
          "Provide a programmatic name for interactive or informative content",
          "Preserve keyboard access, focus visibility, and color-independent meaning"
        ],
        "standard": "WCAG 2.2 AA"
      },
      "capabilities": [
        "agent",
        "progress"
      ],
      "category": "pattern",
      "compatibleTokens": [
        "color",
        "motion",
        "radius",
        "space",
        "type"
      ],
      "docs": {
        "autogenerated": true,
        "storyId": "patterns-agentjob--states",
        "storyPath": "?path=/story/patterns-agentjob--states"
      },
      "example": "import { AgentJob } from \"@knpkv/rly/patterns\"",
      "exports": [
        {
          "kind": "value",
          "name": "AgentJob"
        },
        {
          "kind": "type",
          "name": "AgentJobProps"
        },
        {
          "kind": "type",
          "name": "RlyAgentJobState"
        }
      ],
      "files": {
        "source": "src/patterns/AgentJob.tsx",
        "story": "stories/patterns/AgentJob.stories.tsx",
        "styles": [
          "src/patterns/AgentJob.module.css"
        ],
        "tests": [
          "test/patterns/AgentJob.test.tsx"
        ]
      },
      "importPath": "@knpkv/rly/patterns",
      "name": "AgentJob",
      "props": {
        "defaults": {},
        "types": [
          "AgentJobProps"
        ]
      },
      "purpose": "Present cancellable agent progress and terminal outcomes",
      "slots": [],
      "states": [
        "cancelled",
        "default",
        "failed",
        "queued",
        "running",
        "succeeded"
      ],
      "status": "stable",
      "variants": []
    },
    {
      "accessibility": {
        "automatedChecks": true,
        "requirements": [
          "Provide a programmatic name for interactive or informative content",
          "Preserve keyboard access, focus visibility, and color-independent meaning"
        ],
        "standard": "WCAG 2.2 AA"
      },
      "capabilities": [
        "agent",
        "propose"
      ],
      "category": "pattern",
      "compatibleTokens": [
        "color",
        "motion",
        "radius",
        "space",
        "type"
      ],
      "docs": {
        "autogenerated": true,
        "storyId": "patterns-agentproposal--states",
        "storyPath": "?path=/story/patterns-agentproposal--states"
      },
      "example": "import { AgentProposal } from \"@knpkv/rly/patterns\"",
      "exports": [
        {
          "kind": "value",
          "name": "AgentProposal"
        },
        {
          "kind": "type",
          "name": "AgentProposalProps"
        },
        {
          "kind": "type",
          "name": "RlyAgentIdentity"
        },
        {
          "kind": "type",
          "name": "RlyAgentProposal"
        },
        {
          "kind": "type",
          "name": "RlyAgentProposalEvidence"
        }
      ],
      "files": {
        "source": "src/patterns/AgentProposal.tsx",
        "story": "stories/patterns/AgentProposal.stories.tsx",
        "styles": [
          "src/patterns/AgentProposal.module.css"
        ],
        "tests": [
          "test/patterns/AgentProposal.test.tsx"
        ]
      },
      "importPath": "@knpkv/rly/patterns",
      "name": "AgentProposal",
      "props": {
        "defaults": {},
        "types": [
          "AgentProposalProps"
        ]
      },
      "purpose": "Distinguish an agent proposal from human authorization",
      "slots": [],
      "states": [
        "default",
        "proposed",
        "superseded"
      ],
      "status": "stable",
      "variants": []
    },
    {
      "accessibility": {
        "automatedChecks": true,
        "requirements": [
          "Provide a programmatic name for interactive or informative content",
          "Preserve keyboard access, focus visibility, and color-independent meaning"
        ],
        "standard": "WCAG 2.2 AA"
      },
      "capabilities": [
        "agent",
        "conversation"
      ],
      "category": "pattern",
      "compatibleTokens": [
        "color",
        "motion",
        "radius",
        "space",
        "type"
      ],
      "docs": {
        "autogenerated": true,
        "storyId": "patterns-agentthread--release-thread",
        "storyPath": "?path=/story/patterns-agentthread--release-thread"
      },
      "example": "import { AgentThread } from \"@knpkv/rly/patterns\"",
      "exports": [
        {
          "kind": "value",
          "name": "AgentThread"
        },
        {
          "kind": "type",
          "name": "AgentThreadProps"
        },
        {
          "kind": "type",
          "name": "RlyAgentThreadActor"
        },
        {
          "kind": "type",
          "name": "RlyAgentThreadAgentActor"
        },
        {
          "kind": "type",
          "name": "RlyAgentThreadHumanActor"
        },
        {
          "kind": "type",
          "name": "RlyAgentThreadMessage"
        },
        {
          "kind": "type",
          "name": "RlyAgentThreadSystemActor"
        }
      ],
      "files": {
        "source": "src/patterns/AgentThread.tsx",
        "story": "stories/patterns/AgentThread.stories.tsx",
        "styles": [
          "src/patterns/AgentThread.module.css"
        ],
        "tests": [
          "test/patterns/AgentThread.test.tsx"
        ]
      },
      "importPath": "@knpkv/rly/patterns",
      "name": "AgentThread",
      "props": {
        "defaults": {},
        "types": [
          "AgentThreadProps"
        ]
      },
      "purpose": "Present an isolated human, agent, and system conversation",
      "slots": [],
      "states": [
        "active",
        "default",
        "held"
      ],
      "status": "stable",
      "variants": []
    },
    {
      "accessibility": {
        "automatedChecks": true,
        "requirements": [
          "Provide a programmatic name for interactive or informative content",
          "Preserve keyboard access, focus visibility, and color-independent meaning"
        ],
        "standard": "WCAG 2.2 AA"
      },
      "capabilities": [
        "identify"
      ],
      "category": "primitive",
      "compatibleTokens": [
        "color",
        "motion",
        "radius",
        "space",